{
  "schema_version": 1,
  "files": [
    {
      "source": "test_hidden_cpa.py",
      "destination": "tests/test_hidden_cpa.py"
    }
  ],
  "checks": [
    {
      "name": "hidden acceptance",
      "kind": "acceptance",
      "argv": [
        "python3",
        "-m",
        "unittest",
        "discover",
        "-s",
        "tests",
        "-p",
        "test_*.py"
      ]
    }
  ],
  "impacted_files": [
    "calc.py",
    "tests/test_calc.py"
  ]
}
